¿Qué cantidad económica va a inyectar Google.org a la Universidad de Málaga para su programa de seminarios de ciberseguridad?;Un millón de dólares.; No tengo información suficiente en mis archivos.;INCORRECTO; No tengo información suficiente en mis archivos.;INCORRECTO
¿En qué año fundó el empresario israelí Nir Zuk la firma de ciberseguridad Palo Alto Networks?;En el año 2005.;2005;CORRECTO;2005;CORRECTO
Según el informe del Observatorio de Digitalización de GoDaddy 2023, ¿qué porcentaje de pymes españolas han sido víctimas de algún ciberataque?;El 60% de las empresas españolas.; No tengo información suficiente en mis archivos.;INCORRECTO; El 60% de las pymes españolas han sido víctimas de algún ciberataque.;INCORRECTO
¿Para qué sirve específicamente la solución tecnológica HP Sure Recover mencionada en el informe de protección para pymes?;Para ayudar a restaurar rápidamente la funcionalidad del sitio web en caso de ataques o caídas.; La solución tecnológica HP Sure Recover mencionada en el informe de protección para pymes sirve para restaurar rápidamente la funcionalidad del sitio web en caso de ataques o caídas.;CORRECTO; No tengo información suficiente en mis archivos.;INCORRECTO
¿Qué grupo de hackers ruso reivindicó el último ataque a la infraestructura de Red Eléctrica?;No tengo información suficiente en mis archivos.; No tengo información suficiente en mis archivos.;CORRECTO; No tengo información suficiente en mis archivos.;CORRECTO
Según el estudio de la Asociación Estadounidense del Corazón, ¿cuántas horas de sueño por noche necesita la mayoría de los adultos?;Entre 7 y 9 horas.; No tengo información suficiente en mis archivos.;INCORRECTO; No tengo información suficiente en mis archivos.;INCORRECTO
En el estudio de la Universidad Tecnológica de Sidney sobre la dieta mediterránea, ¿cuántos hombres participaron y de qué rango de edad?;Participaron 71 hombres de edades comprendidas entre 18 y 25 años.; No tengo información suficiente en mis archivos.;INCORRECTO; No tengo información suficiente en mis archivos.;INCORRECTO
Según los investigadores, ¿a través de qué vía o nervio específico se comunican las bacterias del tracto intestinal con el cerebro?;A través del nervio vago.; No tengo información suficiente en mis archivos.;INCORRECTO; El nervio vago es el nervio específico a través del cual se comunican las bacterias del tracto intestinal con el cerebro.;CORRECTO
¿Cuántos participantes se incluyeron en el análisis de datos del estudio SOL-INCA-MRI enfocado en la materia blanca cerebral?;Más de 2.774 participantes.;2774;CORRECTO; No tengo información suficiente en mis archivos.;INCORRECTO
De todos los componentes de la dieta mediterránea, ¿qué dos alimentos específicos se asociaban de manera más estrecha con las características deseables de la materia blanca cerebral?;El pescado y los cereales integrales.; No tengo información suficiente en mis archivos.;INCORRECTO; El consumo de pescado y cereales integrales se asociaba de manera estrecha con las características deseables de la materia blanca cerebral.;CORRECTO
¿En qué revista científica se publicó la nueva declaración de la Asociación Estadounidense del Corazón sobre el sueño y el cardiometabolismo?;En la revista 'Circulation: Cardiovascular Quality and Outcomes'.; No tengo información suficiente en mis archivos.;INCORRECTO;" La nueva declaración de la Asociación Estadounidense del Corazón sobre el sueño y el cardiometabólico se publicó en la revista científica ""Circulation: Cardiovascular Quality and Outcomes"".";CORRECTO
¿En qué hospital español se descubrió que la dieta mediterránea cura clínicamente la depresión profunda en dos semanas?;No tengo información suficiente en mis archivos.; No tengo información suficiente en mis archivos.;CORRECTO; No tengo información suficiente en mis archivos.;CORRECTO